{
  "$schema": "https://json-schema.org/draft/2020-12/schema",
  "$id": "xdebug.trace.x.request.v1",
  "title": "trace.x request",
  "type": "object",
  "required": [
    "api_version",
    "action",
    "args",
    "target"
  ],
  "properties": {
    "api_version": {
      "type": "string",
      "enum": [
        "xdebug.v1"
      ]
    },
    "request_id": {
      "type": "string"
    },
    "action": {
      "type": "string",
      "enum": [
        "trace.x"
      ]
    },
    "target": {
      "type": "object",
      "required": [
        "session_id"
      ],
      "properties": {
        "session_id": {
          "type": "string",
          "description": "目标 xdebug session 标识。"
        },
        "daidir": {
          "type": "string"
        },
        "fsdb": {
          "type": "string"
        },
        "mode": {
          "type": "string",
          "enum": [
            "design",
            "waveform",
            "combined"
          ]
        }
      },
      "additionalProperties": false
    },
    "args": {
      "type": "object",
      "properties": {
        "signal": {
          "type": "string",
          "description": "Final leaf signal path. Aggregate, array, and struct roots are not expanded automatically."
        },
        "time": {
          "type": "string",
          "description": "Target sample time. Prefer a canonical string with a unit; a bare number is interpreted only with time_unit."
        },
        "time_unit": {
          "type": "string",
          "enum": [
            "auto",
            "fs",
            "ps",
            "ns",
            "us",
            "ms",
            "s"
          ],
          "description": "Interprets only unitless time numbers; it never overrides a time string that already has a unit."
        },
        "value_format": {
          "type": "string",
          "enum": [
            "hex",
            "bin",
            "dec"
          ],
          "description": "Action-specific value_format input. Its type and accepted values are defined by this schema.",
          "default": "hex"
        }
      },
      "required": [
        "signal",
        "time"
      ],
      "additionalProperties": false
    },
    "limits": {
      "type": "object",
      "properties": {
        "max_depth": {
          "type": "integer",
          "minimum": 1,
          "default": 8
        },
        "max_nodes": {
          "type": "integer",
          "minimum": 1,
          "default": 50
        },
        "max_time_steps": {
          "type": "integer",
          "minimum": 1,
          "default": 128
        },
        "max_trace_signals": {
          "type": "integer",
          "minimum": 1,
          "default": 64
        },
        "max_chains": {
          "type": "integer",
          "minimum": 1,
          "default": 8
        }
      },
      "additionalProperties": false
    },
    "auth_token": {
      "type": "string"
    },
    "id": {
      "type": "string"
    },
    "trace_id": {
      "type": "string"
    },
    "span_id": {
      "type": "string"
    },
    "parent_span_id": {
      "type": "string"
    }
  },
  "additionalProperties": false,
  "description": "Trace an X value backward through bounded DFS branches to its sources or observability boundaries.",
  "x-description-zh": "从指定信号和时间按受限 DFS 多分支追溯 X 的产生位置或不可见边界。",
  "x-purpose": "从指定 signal/time 追溯 X。",
  "x-how_it_works": "先确认查询值含 X，再按 DFS 同等追踪含 X 的 RHS/control；每条分支每一跳重新定位连续 X 区间起点并可多次向更早时间推进。深度停止时返回可直接续查的 frontier。",
  "x-when_to_use": "找到一个或多个 X 候选源、不可见边界或受限现场。",
  "x-arg_contract_notes": "required: signal, time; optional: value_format; limits: max_depth, max_nodes, max_time_steps, max_trace_signals, max_chains(default 8)",
  "x-agent": {
    "use_when": [
      "查询点含 X，需要按 DFS 同时追踪 RHS、control、端口和时间边界。"
    ],
    "do_not_use_when": [
      "只需要静态 driver 枚举，或查询点不含 X。"
    ],
    "alternatives": [
      {
        "action": "trace.active_driver",
        "when": "只需要指定时刻的单级 active driver。"
      },
      {
        "action": "trace.active_driver_chain",
        "when": "需要传统单链 active-driver 展开。"
      }
    ],
    "constraints": [
      "required: signal, time; optional: value_format; limits: max_depth, max_nodes, max_time_steps, max_trace_signals, max_chains(default 8)"
    ]
  }
}
